{
  "id": "dtc-report-pdf",
  "name": "DTC Report PDF",
  "version": "1.0.0",
  "author": "ohgeeceee",
  "official": true,
  "description": "Export a full diagnostic trouble-code scan as a clean, shareable PDF report with vehicle info and freeze-frame data.",
  "category": "reporting",
  "tags": [
    "dtc",
    "pdf",
    "export",
    "report"
  ],
  "homepage": "https://github.com/ohgeeceee/beemuu-plugins",
  "download": {
    "url": "https://github.com/ohgeeceee/beemuu-plugins/releases/download/v1.1/dtc-report-pdf-1.0.0.zip",
    "sha256": "4e17aef451a744f33e10daa0eb7ddee0a0192b76349a93b7529235f51a3ffff1",
    "sizeBytes": 1922
  },
  "minAppVersion": "2.2.0",
  "license": "GPL-3.0-only",
  "capabilities": [
    "read-vin",
    "read-dtc"
  ]
}
